{
  "$schema": "https://json-schema.org/draft/2020-12/schema",
  "title": "Nearby Narrative Gatherer Output",
  "type": "object",
  "additionalProperties": false,
  "required": [
    "selected_places",
    "local_material",
    "relations",
    "unknown_current_conditions"
  ],
  "properties": {
    "selected_places": {
      "type": "array",
      "minItems": 1,
      "maxItems": 5,
      "items": {
        "type": "object",
        "additionalProperties": false,
        "required": [
          "place_id",
          "source_candidate_id",
          "title",
          "url",
          "latitude",
          "longitude",
          "facts",
          "particulars",
          "affordances",
          "semantic_lures"
        ],
        "properties": {
          "place_id": {
            "type": "string"
          },
          "source_candidate_id": {
            "type": "string"
          },
          "title": {
            "type": "string"
          },
          "url": {
            "type": "string"
          },
          "latitude": {
            "type": "number"
          },
          "longitude": {
            "type": "number"
          },
          "facts": {
            "type": "array",
            "maxItems": 3,
            "items": {
              "$ref": "#/$defs/evidence"
            }
          },
          "particulars": {
            "type": "array",
            "maxItems": 3,
            "items": {
              "$ref": "#/$defs/evidence"
            }
          },
          "affordances": {
            "type": "array",
            "maxItems": 2,
            "items": {
              "type": "string"
            }
          },
          "semantic_lures": {
            "type": "array",
            "maxItems": 2,
            "items": {
              "type": "string"
            }
          }
        }
      }
    },
    "local_material": {
      "type": "array",
      "maxItems": 4,
      "items": {
        "type": "object",
        "additionalProperties": false,
        "required": [
          "evidence_id",
          "source_id",
          "text"
        ],
        "properties": {
          "evidence_id": {
            "type": "string"
          },
          "source_id": {
            "type": "string"
          },
          "text": {
            "type": "string"
          }
        }
      }
    },
    "relations": {
      "type": "array",
      "maxItems": 8,
      "items": {
        "type": "object",
        "additionalProperties": false,
        "required": [
          "relation_id",
          "a",
          "b",
          "text"
        ],
        "properties": {
          "relation_id": {
            "type": "string"
          },
          "a": {
            "type": "string"
          },
          "b": {
            "type": "string"
          },
          "text": {
            "type": "string"
          }
        }
      }
    },
    "unknown_current_conditions": {
      "type": "array",
      "items": {
        "type": "string"
      }
    }
  },
  "$defs": {
    "evidence": {
      "type": "object",
      "additionalProperties": false,
      "required": [
        "evidence_id",
        "text"
      ],
      "properties": {
        "evidence_id": {
          "type": "string"
        },
        "text": {
          "type": "string"
        }
      }
    }
  }
}
